{
  "correlation_id": "corr-20260101-core-0001",
  "created_utc": "2026-01-01T12:00:00Z",
  "source": "browneye.local.bootstrap",
  "silo": "core_ops",
  "silo_tags": [
    "core_ops",
    "local_only"
  ],
  "priority": "normal",
  "status": "submitted",
  "risk_flags": [
    "none"
  ],
  "required_approval": false,
  "proof_required": true,
  "verifier_required": false,
  "related_paths": [
    "Bus/examples"
  ],
  "id": "cartridge-0002-seeds",
  "type": "seeds",
  "payload": {
    "seed_topic": "windows_llm_local_bus",
    "seed_notes": "Bootstrap retrieval corpus from archived tickets.",
    "visibility": "private"
  }
}
