{
  "correlation_id": "corr-20260101-core-0001",
  "created_utc": "2026-01-01T12:00:00Z",
  "source": "browneye.local.bootstrap",
  "silo": "core_ops",
  "silo_tags": [
    "core_ops",
    "local_only"
  ],
  "priority": "normal",
  "status": "submitted",
  "risk_flags": [
    "public_action"
  ],
  "required_approval": true,
  "proof_required": true,
  "verifier_required": false,
  "related_paths": [
    "Bus/examples"
  ],
  "id": "cartridge-0010-approval_requests",
  "type": "approval_requests",
  "payload": {
    "request_summary": "Publish weekly changelog to public status page.",
    "requested_by": "orchestrator",
    "visibility": "public"
  },
  "approval": {
    "status": "pending"
  }
}
